{
  "claim_id": "pilot-global-wheat-002-llm-claim-0208",
  "run_id": "pilot-global-wheat-002",
  "entity": {
    "entity_type": "crop",
    "name": "wheat"
  },
  "parameter_id": "stress.frost_risk_stage",
  "attribute": "stress_sensitivity",
  "attribute_subtype": "frost_sensitive_stage",
  "claim_text": "At boot stage, 28\u00b0F for 2 hours causes freeze injury (floret sterility); moderate-to-severe yield impact",
  "value": {
    "value_type": "numeric",
    "raw_value_text": "Boot 28\u00b0 F Floret sterility; spike trapped in the boot; damage to lower stem; leaf discoloration, odor Moderate to severe",
    "qualifier": "threshold",
    "unit": "celsius",
    "numeric_value": -2.22
  },
  "location_scope": {
    "level": "global",
    "name": "global",
    "geo_id": "global",
    "geocode_source": "not_applicable",
    "geocode_confidence": "none",
    "coordinate_system": "EPSG:4326"
  },
  "source_geo_scope": {
    "level": "state",
    "name": "South Dakota",
    "geo_id": "census:0400000US46",
    "centroid": {
      "lat": 44.446796,
      "lon": -100.238176
    },
    "geocode_source": "us_census_gazetteer_2025:state",
    "geocode_confidence": "approximate",
    "coordinate_system": "EPSG:4326"
  },
  "geo_evidence": {
    "claim_location_source": "default_global",
    "claim_location_confidence": "none",
    "claim_location_text": "",
    "source_location_source": "raw_snippet",
    "source_location_confidence": "medium",
    "source_location_text": "4-35 extension.sdstate.edu | \u00a9 2019, South Dakota Board of Regents Winter wheat planting in South Dakota begins in mid September with the aim of establishing a healthy a",
    "matched_locations": [
      {
        "field": "source_location:raw_snippet",
        "level": "state",
        "name": "South Dakota",
        "evidence_text": "4-35 extension.sdstate.edu | \u00a9 2019, South Dakota Board of Regents Winter wheat planting in South Dakota begins in mid September with the aim of establishing a healthy a"
      }
    ]
  },
  "time_scope": {
    "label": "growing season"
  },
  "provenance": {
    "source_urls": [
      "https://extension.sdstate.edu/sites/default/files/2020-03/S-0005-04-Wheat.pdf"
    ],
    "source_title": "https://extension.sdstate.edu/sites/default/files/2020-03/S-0005-04-Wheat.pdf",
    "source_domain": "extension.sdstate.edu",
    "document_type": "pdf",
    "source_tier_id": "extension_publication",
    "source_tier_label": "",
    "discovery_method": "discover_pipeline",
    "access_status": "open_full_text",
    "accessed_at": "2026-06-24T12:00:16Z",
    "extraction_method": "llm:fixture",
    "evidence_text": "Boot 28\u00b0 F Floret sterility; spike trapped in the boot; damage to lower stem; leaf discoloration, odor Moderate to severe",
    "manifest_version": "0.4.0",
    "notes": "2019",
    "source_publication_year": 2019,
    "document_id": "doc-d2a2acac0e8658eb",
    "block_type": "table",
    "table_label": "Table 4.1"
  },
  "observation_type": "threshold",
  "confidence": "high",
  "conflict_status": "none",
  "status": "load_ready",
  "agronomic_scope": {
    "management_system": "winter wheat"
  }
}
