{
  "claim_id": "pilot-global-wheat-002-llm-claim-0222",
  "run_id": "pilot-global-wheat-002",
  "entity": {
    "entity_type": "crop",
    "name": "wheat"
  },
  "parameter_id": "planting.planting_window",
  "attribute": "planting_window",
  "attribute_subtype": "planting_date_window",
  "claim_text": "Durum wheat sown in late November to early December in southern Italy (Mediterranean).",
  "value": {
    "value_type": "text",
    "raw_value_text": "The sowing dates were 1st December (2018) and 24thPage 3 of 11 Carucci etal.Agriculture&FoodSecurity (2023)12:12 November (2019).",
    "text_value": "Durum wheat sown in late November to early December in southern Italy (Mediterranean).",
    "qualifier": "descriptive"
  },
  "location_scope": {
    "level": "global",
    "name": "global",
    "geo_id": "global",
    "geocode_source": "not_applicable",
    "geocode_confidence": "none",
    "coordinate_system": "EPSG:4326"
  },
  "source_geo_scope": {
    "level": "global",
    "name": "global",
    "geo_id": "global",
    "geocode_source": "not_applicable",
    "geocode_confidence": "none",
    "coordinate_system": "EPSG:4326"
  },
  "geo_evidence": {
    "claim_location_source": "default_global",
    "claim_location_confidence": "none",
    "claim_location_text": "",
    "source_location_source": "default_global",
    "source_location_confidence": "none",
    "source_location_text": "",
    "matched_locations": []
  },
  "time_scope": {
    "label": "planting season"
  },
  "provenance": {
    "source_urls": [
      "https://link.springer.com/content/pdf/10.1186/s40066-023-00417-5.pdf"
    ],
    "source_title": "https://agricultureandfoodsecurity.biomedcentral.com/counter/pdf/10.1186/s40066-023-00417-5",
    "source_domain": "agricultureandfoodsecurity.biomedcentral.com",
    "document_type": "pdf",
    "source_tier_id": "peer_reviewed_science",
    "source_tier_label": "",
    "discovery_method": "discover_pipeline",
    "access_status": "open_full_text",
    "accessed_at": "2026-06-24T12:00:16Z",
    "extraction_method": "llm:fixture",
    "evidence_text": "The sowing dates were 1st December (2018) and 24thPage 3 of 11 Carucci etal.Agriculture&FoodSecurity (2023)12:12 November (2019).",
    "manifest_version": "0.4.0",
    "notes": "2023",
    "source_publication_year": 2023,
    "document_id": "doc-eaa3a9100bd91067",
    "block_type": "paragraph"
  },
  "observation_type": "condition",
  "confidence": "high",
  "conflict_status": "none",
  "status": "load_ready",
  "agronomic_scope": {
    "management_system": "organic farming, Mediterranean"
  }
}
