{
  "claim_id": "pilot-global-wheat-002-llm-claim-0101",
  "run_id": "pilot-global-wheat-002",
  "entity": {
    "entity_type": "crop",
    "name": "wheat"
  },
  "parameter_id": "temperature.optimum_growth_temperature",
  "attribute": "preferred_temperature",
  "attribute_subtype": "general_temperature_condition",
  "claim_text": "Cool winter season temperatures of 0-20 degC are ideal for wheat production in Zimbabwe.",
  "value": {
    "value_type": "range",
    "raw_value_text": "wheat, a temperate crop, in Zimbabwe is mainly grown in the midveld and highveld areas (altitude above 600 m) were the cool winter season (0\u201320 o C) has proved ideal for wheat production (Havazvidi, 2006).",
    "range_min": 0.0,
    "range_max": 20.0,
    "qualifier": "optimal",
    "unit": "degC"
  },
  "location_scope": {
    "level": "global",
    "name": "global",
    "geo_id": "global",
    "geocode_source": "not_applicable",
    "geocode_confidence": "none",
    "coordinate_system": "EPSG:4326"
  },
  "source_geo_scope": {
    "level": "global",
    "name": "global",
    "geo_id": "global",
    "geocode_source": "not_applicable",
    "geocode_confidence": "none",
    "coordinate_system": "EPSG:4326"
  },
  "geo_evidence": {
    "claim_location_source": "default_global",
    "claim_location_confidence": "none",
    "claim_location_text": "",
    "source_location_source": "default_global",
    "source_location_confidence": "none",
    "source_location_text": "",
    "matched_locations": []
  },
  "time_scope": {
    "label": "growing season"
  },
  "provenance": {
    "source_urls": [
      "https://www.watersa.net/index.php/watersa/en/article/download/6748/8047"
    ],
    "source_title": "https://www.watersa.net/article/download/6748/8047",
    "source_domain": "www.watersa.net",
    "document_type": "pdf",
    "source_tier_id": "peer_reviewed_science",
    "source_tier_label": "",
    "discovery_method": "discover_pipeline",
    "access_status": "open_full_text",
    "accessed_at": "2026-06-24T12:00:16Z",
    "extraction_method": "llm:fixture",
    "evidence_text": "wheat, a temperate crop, in Zimbabwe is mainly grown in the midveld and highveld areas (altitude above 600 m) were the cool winter season (0\u201320 o C) has proved ideal for wheat production (Havazvidi, 2006).",
    "manifest_version": "0.4.0",
    "notes": "2019",
    "source_publication_year": 2019,
    "document_id": "doc-36840c071fb734b6",
    "block_type": "paragraph"
  },
  "observation_type": "condition",
  "confidence": "medium",
  "conflict_status": "none",
  "status": "load_ready",
  "agronomic_scope": {
    "management_system": "irrigated"
  }
}
