{
  "claim_id": "pilot-global-wheat-002-llm-claim-0120",
  "run_id": "pilot-global-wheat-002",
  "entity": {
    "entity_type": "crop",
    "name": "wheat"
  },
  "parameter_id": "canopy.harvest_index",
  "attribute": "biomass_partitioning",
  "attribute_subtype": "harvest_index",
  "claim_text": "Heat stress at the reproductive stage reduced wheat harvest index by 39%.",
  "value": {
    "value_type": "text",
    "raw_value_text": "Heat stress caused 53% reduction in grain yield followed by 39% reduction in harvest index and 11% percent reduction in grains per spike.",
    "text_value": "Heat stress at the reproductive stage reduced wheat harvest index by 39%.",
    "qualifier": "risk"
  },
  "location_scope": {
    "level": "global",
    "name": "global",
    "geo_id": "global",
    "geocode_source": "not_applicable",
    "geocode_confidence": "none",
    "coordinate_system": "EPSG:4326"
  },
  "source_geo_scope": {
    "level": "global",
    "name": "global",
    "geo_id": "global",
    "geocode_source": "not_applicable",
    "geocode_confidence": "none",
    "coordinate_system": "EPSG:4326"
  },
  "geo_evidence": {
    "claim_location_source": "default_global",
    "claim_location_confidence": "none",
    "claim_location_text": "",
    "source_location_source": "default_global",
    "source_location_confidence": "none",
    "source_location_text": "",
    "matched_locations": []
  },
  "time_scope": {
    "label": "growing season"
  },
  "provenance": {
    "source_urls": [
      "https://doi.org/10.1038/s41598-019-43477-z"
    ],
    "source_title": "https://doi.org/10.1038/s41598-019-43477-z",
    "source_domain": "doi.org",
    "document_type": "other",
    "source_tier_id": "peer_reviewed_science",
    "source_tier_label": "",
    "discovery_method": "discover_pipeline",
    "access_status": "open_full_text",
    "accessed_at": "2026-06-24T12:00:16Z",
    "extraction_method": "llm:fixture",
    "evidence_text": "Heat stress caused 53% reduction in grain yield followed by 39% reduction in harvest index and 11% percent reduction in grains per spike.",
    "manifest_version": "0.4.0",
    "notes": "",
    "document_id": "doc-6eb44534d34e404f",
    "block_type": "paragraph"
  },
  "observation_type": "risk",
  "confidence": "low",
  "conflict_status": "none",
  "status": "load_ready",
  "agronomic_scope": {
    "management_system": "glasshouse, heat stress"
  }
}
