{
  "claim_id": "pilot-global-wheat-002-llm-claim-0057",
  "run_id": "pilot-global-wheat-002",
  "entity": {
    "entity_type": "crop",
    "name": "wheat"
  },
  "parameter_id": "water.drought_sensitive_stage",
  "attribute": "moisture_requirement",
  "attribute_subtype": "drought_sensitive_stage",
  "claim_text": "Wheat developmental stages from heading to anthesis (BBCH 50-69) are especially sensitive to drought stress.",
  "value": {
    "value_type": "text",
    "raw_value_text": "The developmental stages from heading until anthesis are especially sensitive to drought stress Gonz\u00e1lez-Navarro et al. (2015). If drought stress is too severe, shedding of fertilised \ufb02orets can occur after anthesis.",
    "text_value": "Wheat developmental stages from heading to anthesis (BBCH 50-69) are especially sensitive to drought stress.",
    "qualifier": "risk"
  },
  "location_scope": {
    "level": "global",
    "name": "global",
    "geo_id": "global",
    "geocode_source": "not_applicable",
    "geocode_confidence": "none",
    "coordinate_system": "EPSG:4326"
  },
  "source_geo_scope": {
    "level": "global",
    "name": "global",
    "geo_id": "global",
    "geocode_source": "not_applicable",
    "geocode_confidence": "none",
    "coordinate_system": "EPSG:4326"
  },
  "geo_evidence": {
    "claim_location_source": "default_global",
    "claim_location_confidence": "none",
    "claim_location_text": "",
    "source_location_source": "default_global",
    "source_location_confidence": "none",
    "source_location_text": "",
    "matched_locations": []
  },
  "time_scope": {
    "label": "growing season"
  },
  "provenance": {
    "source_urls": [
      "https://www.frontiersin.org/journals/plant-science/articles/10.3389/fpls.2024.1319938/pdf"
    ],
    "source_title": "https://www.frontiersin.org/journals/plant-science/articles/10.3389/fpls.2024.1319938/pdf",
    "source_domain": "www.frontiersin.org",
    "document_type": "pdf",
    "source_tier_id": "peer_reviewed_science",
    "source_tier_label": "",
    "discovery_method": "discover_pipeline",
    "access_status": "open_full_text",
    "accessed_at": "2026-06-24T12:00:16Z",
    "extraction_method": "llm:fixture",
    "evidence_text": "The developmental stages from heading until anthesis are especially sensitive to drought stress Gonz\u00e1lez-Navarro et al. (2015). If drought stress is too severe, shedding of fertilised \ufb02orets can occur after anthesis.",
    "manifest_version": "0.4.0",
    "notes": "",
    "document_id": "doc-d9b7385669230d47",
    "block_type": "paragraph"
  },
  "observation_type": "risk",
  "confidence": "high",
  "conflict_status": "none",
  "status": "load_ready",
  "bbch_applicability": {
    "bbch_min": 50,
    "bbch_max": 69,
    "evidence_text": "The developmental stages from heading until anthesis are especially sensitive to drought stress Gonz\u00e1lez-Navarro et al. (2015). If drought stress is too severe, shedding of fertilised \ufb02orets can occur after anthesis.",
    "confidence": "high"
  }
}
