{
  "claim_id": "pilot-global-wheat-002-llm-claim-0053",
  "run_id": "pilot-global-wheat-002",
  "entity": {
    "entity_type": "crop",
    "name": "wheat"
  },
  "parameter_id": "water.drought_sensitive_stage",
  "attribute": "moisture_requirement",
  "attribute_subtype": "drought_sensitive_stage",
  "claim_text": "Booting and heading are the wheat reproductive stages most sensitive to drought; heat and water stress at this period can drop grain yield 30-90%.",
  "value": {
    "value_type": "text",
    "raw_value_text": "Wheat's booting and heading are important reproductive stages and are the most sensitive to drought, as heat and water stresses could lead to a drop of 30\u201390% in wheat grain yield",
    "text_value": "Booting and heading are the wheat reproductive stages most sensitive to drought; heat and water stress at this period can drop grain yield 30-90%.",
    "qualifier": "risk"
  },
  "location_scope": {
    "level": "global",
    "name": "global",
    "geo_id": "global",
    "geocode_source": "not_applicable",
    "geocode_confidence": "none",
    "coordinate_system": "EPSG:4326"
  },
  "source_geo_scope": {
    "level": "global",
    "name": "global",
    "geo_id": "global",
    "geocode_source": "not_applicable",
    "geocode_confidence": "none",
    "coordinate_system": "EPSG:4326"
  },
  "geo_evidence": {
    "claim_location_source": "default_global",
    "claim_location_confidence": "none",
    "claim_location_text": "",
    "source_location_source": "default_global",
    "source_location_confidence": "none",
    "source_location_text": "",
    "matched_locations": []
  },
  "time_scope": {
    "label": "growing season"
  },
  "provenance": {
    "source_urls": [
      "https://link.springer.com/content/pdf/10.1186/s40066-023-00428-2.pdf"
    ],
    "source_title": "https://agricultureandfoodsecurity.biomedcentral.com/counter/pdf/10.1186/s40066-023-00428-2",
    "source_domain": "agricultureandfoodsecurity.biomedcentral.com",
    "document_type": "pdf",
    "source_tier_id": "peer_reviewed_science",
    "source_tier_label": "",
    "discovery_method": "discover_pipeline",
    "access_status": "open_full_text",
    "accessed_at": "2026-06-24T12:00:16Z",
    "extraction_method": "llm:fixture",
    "evidence_text": "Wheat's booting and heading are important reproductive stages and are the most sensitive to drought, as heat and water stresses could lead to a drop of 30\u201390% in wheat grain yield",
    "manifest_version": "0.4.0",
    "notes": "2023",
    "source_publication_year": 2023,
    "document_id": "doc-a910db2a31d8d8ea",
    "block_type": "paragraph"
  },
  "observation_type": "risk",
  "confidence": "high",
  "conflict_status": "none",
  "status": "load_ready"
}
