{
  "claim_id": "pilot-global-wheat-002-llm-claim-0252",
  "run_id": "pilot-global-wheat-002",
  "entity": {
    "entity_type": "crop",
    "name": "wheat"
  },
  "parameter_id": "water.irrigation_trigger",
  "attribute": "irrigation_management",
  "attribute_subtype": "irrigation_trigger",
  "claim_text": "Schedule irrigation to maintain soil water above 50% depletion",
  "value": {
    "value_type": "text",
    "raw_value_text": "Irrigation management strategies for full yield potential need to include scheduling of irrigation application to maintain soil water above 50 percent depletion.",
    "text_value": "Schedule irrigation to maintain soil water above 50% depletion",
    "qualifier": "recommended"
  },
  "location_scope": {
    "level": "global",
    "name": "global",
    "geo_id": "global",
    "geocode_source": "not_applicable",
    "geocode_confidence": "none",
    "coordinate_system": "EPSG:4326"
  },
  "source_geo_scope": {
    "level": "state",
    "name": "Kansas",
    "geo_id": "census:0400000US20",
    "centroid": {
      "lat": 38.498546,
      "lon": -98.38343
    },
    "geocode_source": "us_census_gazetteer_2025:state",
    "geocode_confidence": "approximate",
    "coordinate_system": "EPSG:4326"
  },
  "geo_evidence": {
    "claim_location_source": "default_global",
    "claim_location_confidence": "none",
    "claim_location_text": "",
    "source_location_source": "raw_snippet",
    "source_location_confidence": "medium",
    "source_location_text": "Wheat Production Handbook K-State Research & Extension Manhattan, Kansas1\n\nGrowth and Development Gary M. Paulsen, Crop Research Physiologist, Agronomy 2 Varieties Rollin G. Sears, Wheat Breed",
    "matched_locations": [
      {
        "field": "source_location:raw_snippet",
        "level": "state",
        "name": "Kansas",
        "evidence_text": "Wheat Production Handbook K-State Research & Extension Manhattan, Kansas1\n\nGrowth and Development Gary M. Paulsen, Crop Research Physiologist, Agronomy 2 Varieties Rollin G. Sears, Wheat Breed"
      }
    ]
  },
  "time_scope": {
    "label": "growing season"
  },
  "provenance": {
    "source_urls": [
      "https://bookstore.ksre.ksu.edu/pubs/wheat-production-handbook_C529.pdf"
    ],
    "source_title": "https://bookstore.ksre.ksu.edu/pubs/wheat-production-handbook_C529.pdf",
    "source_domain": "bookstore.ksre.ksu.edu",
    "document_type": "pdf",
    "source_tier_id": "extension_publication",
    "source_tier_label": "",
    "discovery_method": "discover_pipeline",
    "access_status": "open_full_text",
    "accessed_at": "2026-06-24T12:00:16Z",
    "extraction_method": "llm:fixture",
    "evidence_text": "Irrigation management strategies for full yield potential need to include scheduling of irrigation application to maintain soil water above 50 percent depletion.",
    "manifest_version": "0.4.0",
    "notes": "",
    "document_id": "doc-fa3c9643f58e9cfe",
    "block_type": "paragraph"
  },
  "observation_type": "recommendation",
  "confidence": "high",
  "conflict_status": "none",
  "status": "load_ready",
  "agronomic_scope": {
    "cultivar": "winter wheat",
    "management_system": "irrigated"
  }
}
