{
  "claim_id": "pilot-global-wheat-002-llm-claim-0039",
  "run_id": "pilot-global-wheat-002",
  "entity": {
    "entity_type": "crop",
    "name": "wheat"
  },
  "parameter_id": "soil.salinity_threshold",
  "attribute": "salinity_tolerance",
  "attribute_subtype": "soil_salinity_threshold",
  "claim_text": "The wheat experimental soil had an electrical conductivity of 3.45 dS/m before planting.",
  "value": {
    "value_type": "numeric",
    "raw_value_text": "Electrical conductivity (EC) 3.45 dS.m-1",
    "numeric_value": 3.45,
    "qualifier": "descriptive",
    "unit": "dS/m"
  },
  "location_scope": {
    "level": "global",
    "name": "global",
    "geo_id": "global",
    "geocode_source": "not_applicable",
    "geocode_confidence": "none",
    "coordinate_system": "EPSG:4326"
  },
  "source_geo_scope": {
    "level": "global",
    "name": "global",
    "geo_id": "global",
    "geocode_source": "not_applicable",
    "geocode_confidence": "none",
    "coordinate_system": "EPSG:4326"
  },
  "geo_evidence": {
    "claim_location_source": "default_global",
    "claim_location_confidence": "none",
    "claim_location_text": "",
    "source_location_source": "default_global",
    "source_location_confidence": "none",
    "source_location_text": "",
    "matched_locations": []
  },
  "time_scope": {
    "label": "growing season"
  },
  "provenance": {
    "source_urls": [
      "https://doi.org/10.55362/ije/2023/4069"
    ],
    "source_title": "https://doi.org/10.55362/ije/2023/4069",
    "source_domain": "doi.org",
    "document_type": "other",
    "source_tier_id": "peer_reviewed_science",
    "source_tier_label": "",
    "discovery_method": "discover_pipeline",
    "access_status": "open_full_text",
    "accessed_at": "2026-06-24T12:00:16Z",
    "extraction_method": "llm:fixture",
    "evidence_text": "Electrical conductivity (EC) 3.45 dS.m-1",
    "manifest_version": "0.4.0",
    "notes": "",
    "document_id": "doc-676fc98e6a9776da",
    "block_type": "table",
    "table_label": "Table 1. Chemical and physical properties of soil before planting"
  },
  "observation_type": "condition",
  "confidence": "medium",
  "conflict_status": "potential",
  "status": "load_ready",
  "conflict_reason": "multiple incompatible quantitative claims for the same attribute subtype and scope"
}
