{
  "claim_id": "pilot-global-wheat-002-llm-claim-0088",
  "run_id": "pilot-global-wheat-002",
  "entity": {
    "entity_type": "crop",
    "name": "wheat"
  },
  "parameter_id": "soil.soil_water_holding_capacity",
  "attribute": "soil_water_storage",
  "attribute_subtype": "soil_water_holding_capacity",
  "claim_text": "Total available water at wheat root depth was 111.9 mm.",
  "value": {
    "value_type": "numeric",
    "raw_value_text": "Thus, TAW at wheat root depth was 111.9mm.",
    "numeric_value": 111.9,
    "qualifier": "descriptive",
    "unit": "mm"
  },
  "location_scope": {
    "level": "global",
    "name": "global",
    "geo_id": "global",
    "geocode_source": "not_applicable",
    "geocode_confidence": "none",
    "coordinate_system": "EPSG:4326"
  },
  "source_geo_scope": {
    "level": "state",
    "name": "Idaho",
    "geo_id": "census:0400000US16",
    "centroid": {
      "lat": 44.348422,
      "lon": -114.558854
    },
    "geocode_source": "us_census_gazetteer_2025:state",
    "geocode_confidence": "approximate",
    "coordinate_system": "EPSG:4326"
  },
  "geo_evidence": {
    "claim_location_source": "default_global",
    "claim_location_confidence": "none",
    "claim_location_text": "",
    "source_location_source": "raw_snippet",
    "source_location_confidence": "medium",
    "source_location_text": "Int J Environ Sci Nat Res 21(1): IJESNR.MS.ID.556054 (2019) 0030 Introduction Waterisafiniteresourceusedindifferentsectorslikeagricul ture, domestic and industry. The competition for both quality and",
    "matched_locations": [
      {
        "field": "source_location:raw_snippet",
        "level": "state",
        "name": "Idaho",
        "evidence_text": "Int J Environ Sci Nat Res 21(1): IJESNR.MS.ID.556054 (2019) 0030 Introduction Waterisafiniteresourceusedindifferentsectorslikeagricul ture, domestic and industry. The competition for both quality and"
      }
    ]
  },
  "time_scope": {
    "label": "growing season"
  },
  "provenance": {
    "source_urls": [
      "https://doi.org/10.19080/ijesnr.2019.21.556054"
    ],
    "source_title": "https://doi.org/10.19080/ijesnr.2019.21.556054",
    "source_domain": "doi.org",
    "document_type": "other",
    "source_tier_id": "peer_reviewed_science",
    "source_tier_label": "",
    "discovery_method": "discover_pipeline",
    "access_status": "open_full_text",
    "accessed_at": "2026-06-24T12:00:16Z",
    "extraction_method": "llm:fixture",
    "evidence_text": "Thus, TAW at wheat root depth was 111.9mm.",
    "manifest_version": "0.4.0",
    "notes": "",
    "document_id": "doc-2b0f9eabe1e131b6",
    "block_type": "paragraph"
  },
  "observation_type": "condition",
  "confidence": "high",
  "conflict_status": "none",
  "status": "load_ready",
  "agronomic_scope": {
    "cultivar": "Kekeba"
  }
}
