{
  "claim_id": "pilot-global-wheat-002-llm-claim-0172",
  "run_id": "pilot-global-wheat-002",
  "entity": {
    "entity_type": "crop",
    "name": "wheat"
  },
  "parameter_id": "soil.ph_range",
  "attribute": "soil_chemistry_requirement",
  "attribute_subtype": "soil_ph_range",
  "claim_text": "Wheat field experiment soil was sandy-loam with pH 6.7.",
  "value": {
    "value_type": "numeric",
    "raw_value_text": "on sandy-loam soil, having 222.94, 23.63 and 189.20 kgha of available N, P and K, respectively, with organic carbon content 0.53% and pH 6.7.",
    "numeric_value": 6.7,
    "qualifier": "descriptive",
    "unit": "pH"
  },
  "location_scope": {
    "level": "global",
    "name": "global",
    "geo_id": "global",
    "geocode_source": "not_applicable",
    "geocode_confidence": "none",
    "coordinate_system": "EPSG:4326"
  },
  "source_geo_scope": {
    "level": "global",
    "name": "global",
    "geo_id": "global",
    "geocode_source": "not_applicable",
    "geocode_confidence": "none",
    "coordinate_system": "EPSG:4326"
  },
  "geo_evidence": {
    "claim_location_source": "default_global",
    "claim_location_confidence": "none",
    "claim_location_text": "",
    "source_location_source": "default_global",
    "source_location_confidence": "none",
    "source_location_text": "",
    "matched_locations": []
  },
  "time_scope": {
    "label": "growing season"
  },
  "provenance": {
    "source_urls": [
      "https://doi.org/10.59797/ija.v46i2.3249"
    ],
    "source_title": "https://doi.org/10.59797/ija.v46i2.3249",
    "source_domain": "doi.org",
    "document_type": "other",
    "source_tier_id": "peer_reviewed_science",
    "source_tier_label": "",
    "discovery_method": "discover_pipeline",
    "access_status": "open_full_text",
    "accessed_at": "2026-06-24T12:00:16Z",
    "extraction_method": "llm:fixture",
    "evidence_text": "on sandy-loam soil, having 222.94, 23.63 and 189.20 kgha of available N, P and K, respectively, with organic carbon content 0.53% and pH 6.7.",
    "manifest_version": "0.4.0",
    "notes": "",
    "document_id": "doc-add4179a186de37b",
    "block_type": "paragraph"
  },
  "observation_type": "condition",
  "confidence": "high",
  "conflict_status": "none",
  "status": "load_ready",
  "agronomic_scope": {
    "management_system": "irrigated"
  }
}
