{
  "claim_id": "pilot-global-wheat-002-llm-claim-0186",
  "run_id": "pilot-global-wheat-002",
  "entity": {
    "entity_type": "crop",
    "name": "wheat"
  },
  "parameter_id": "management.rotation_recommendation",
  "attribute": "rotation_management",
  "attribute_subtype": "rotation_recommendation",
  "claim_text": "Winter wheat grown in a continuous winter wheat-summer maize double cropping rotation; wheat harvested early June and sown early October in the North China Plain.",
  "value": {
    "value_type": "text",
    "raw_value_text": "The experimenthadacommonandcontinuousdoublecroppingsystemrotationofwinterwheat (Triticum aestivum L.) and summer maize (Zea mays L.). Each year in early June, the winter wheat is harvested and maize is planted; while in early October maize is harvested and winter wheat is plant",
    "text_value": "Winter wheat grown in a continuous winter wheat-summer maize double cropping rotation; wheat harvested early June and sown early October in the North China Plain.",
    "qualifier": "descriptive"
  },
  "location_scope": {
    "level": "global",
    "name": "global",
    "geo_id": "global",
    "geocode_source": "not_applicable",
    "geocode_confidence": "none",
    "coordinate_system": "EPSG:4326"
  },
  "source_geo_scope": {
    "level": "global",
    "name": "global",
    "geo_id": "global",
    "geocode_source": "not_applicable",
    "geocode_confidence": "none",
    "coordinate_system": "EPSG:4326"
  },
  "geo_evidence": {
    "claim_location_source": "default_global",
    "claim_location_confidence": "none",
    "claim_location_text": "",
    "source_location_source": "default_global",
    "source_location_confidence": "none",
    "source_location_text": "",
    "matched_locations": []
  },
  "time_scope": {
    "label": "growing season"
  },
  "provenance": {
    "source_urls": [
      "https://edepot.wur.nl/577735"
    ],
    "source_title": "https://edepot.wur.nl/577735",
    "source_domain": "edepot.wur.nl",
    "document_type": "pdf",
    "source_tier_id": "peer_reviewed_science",
    "source_tier_label": "",
    "discovery_method": "discover_pipeline",
    "access_status": "open_full_text",
    "accessed_at": "2026-06-24T12:00:16Z",
    "extraction_method": "llm:fixture",
    "evidence_text": "The experimenthadacommonandcontinuousdoublecroppingsystemrotationofwinterwheat (Triticum aestivum L.) and summer maize (Zea mays L.). Each year in early June, the winter wheat is harvested and maize is planted; while in early October maize is harvested and winter wheat is plant",
    "manifest_version": "0.4.0",
    "notes": "2022",
    "source_publication_year": 2022,
    "document_id": "doc-c5fb186dde37d64a",
    "block_type": "paragraph"
  },
  "observation_type": "condition",
  "confidence": "high",
  "conflict_status": "none",
  "status": "load_ready",
  "agronomic_scope": {
    "management_system": "winter wheat-summer maize double cropping, irrigated, North China Plain"
  }
}
